{
  "version": "0.1.0",
  "lastUpdate": "2026-08-21T00:00:00.000Z",
  "count": 7,
  "source": "https://observatorioia.org",
  "license": "CC BY 4.0",
  "data": [
    {
      "numero": "23.771",
      "titulo": {
        "es": "Ley para Regular la Inteligencia Artificial en Costa Rica",
        "en": "Law to Regulate Artificial Intelligence in Costa Rica"
      },
      "resumen": {
        "es": "Marco general para el desarrollo, uso y aplicación de la IA en Costa Rica. El texto sustitutivo vigente (septiembre 2024) designa al MICITT como órgano rector, con apoyo técnico de la SUTEL, a cargo del registro, la supervisión y la auditoría; define cuatro niveles de riesgo y exige que los chatbots informen que la interacción es con un sistema de IA y que los deepfakes divulguen que el contenido fue generado o alterado artificialmente. Cuenta con dictamen afirmativo de mayoría en la Comisión de Ciencia, Tecnología y Educación y está en el orden del día del Plenario desde octubre de 2024, sin votación. Proponente: Vanessa Castro Mora (PUSC). El expediente vence el 30 de mayo de 2027 si no se aprueba antes.",
        "en": "General framework for the development, use and application of AI in Costa Rica. The current substitute text (September 2024) designates MICITT as the governing authority, with technical support from SUTEL, responsible for registration, oversight and auditing; it sets four risk levels and requires chatbots to disclose that the interaction is with an AI system and deepfakes to disclose that the content was artificially generated or altered. It has a majority affirmative committee report from the Science, Technology and Education Committee and has been on the Plenary agenda since October 2024, without a vote. Filed by Vanessa Castro Mora (PUSC). The bill expires on May 30, 2027 if it is not approved before then."
      },
      "estado": "dictaminado",
      "alcanceIA": "principal",
      "comision": {
        "es": "Ciencia, Tecnología y Educación",
        "en": "Science, Technology and Education"
      },
      "presentado": "2023",
      "fuenteUrl": "https://delfino.cr/asamblea/proyecto/23771",
      "fuenteEstadoUrl": "https://www.asamblea.go.cr/ca/Lists/cp/DispForm.aspx?ContentTypeId=0x01008922D325D4FE564292B03FD67DF003A7&ID=22860",
      "fechaUltimaVerificacion": "2026-08-21"
    },
    {
      "numero": "23.885",
      "titulo": {
        "es": "Ley para Regular las Nuevas Formas de Propaganda",
        "en": "Law to Regulate New Forms of Propaganda"
      },
      "resumen": {
        "es": "Reforma electoral más amplia que busca regular nuevas formas de propaganda política. El expediente cuenta con dictamen y llegó al Plenario. Las mociones de fondo presentadas al texto incluyeron reglas sobre perfiles falsos, contenido sintético, inteligencia artificial y deepfakes; el observatorio lo clasifica como directamente relacionado, no como una ley general de IA. Las mociones documentan propuestas legislativas y no se presentan aquí como texto aprobado.",
        "en": "Broader electoral reform intended to regulate new forms of political advertising. The bill has a committee report and reached the Plenary. Floor amendments filed against the text included rules on fake profiles, synthetic content, artificial intelligence and deepfakes; the observatory classifies it as directly related, not as a general AI law. The amendments document legislative proposals and are not presented here as enacted text."
      },
      "estado": "dictaminado",
      "alcanceIA": "relacionado",
      "comision": {
        "es": "Reformas Electorales",
        "en": "Electoral Reform"
      },
      "presentado": "2023",
      "fuenteUrl": "https://delfino.cr/asamblea/proyecto/23885",
      "fuenteEstadoUrl": "https://www.asamblea.go.cr/glcp/Consultas_mociones/MOCIONES%20DE%20FONDO%20V%C3%8DA%20ART%C3%8DCULO%20137/23.885/23.885%20Primer%20d%C3%ADa%2023-4-2025.pdf",
      "fechaUltimaVerificacion": "2026-08-21"
    },
    {
      "numero": "23.919",
      "titulo": {
        "es": "Ley para la Promoción Responsable de la Inteligencia Artificial en Costa Rica",
        "en": "Law for the Responsible Promotion of Artificial Intelligence in Costa Rica"
      },
      "resumen": {
        "es": "Marco para la promoción responsable de la IA con énfasis en los derechos fundamentales. El texto sustitutivo vigente (marzo 2025) crea la Comisión Interinstitucional para el Desarrollo de la IA (CIDIA), adscrita al MICITT, y un comité asesor ético, técnico y científico; define la categoría de sistemas de alto riesgo y sanciona el uso de IA para desinformar mediante contenido lingüístico y para generar archivos de video, imagen o voz que aparenten ser auténticos con el fin de engañar. Cuenta con dictamen afirmativo de mayoría en la Comisión de Derechos Humanos y está en el orden del día del Plenario desde abril de 2025, sin votación. Proponente: Óscar Izquierdo Sandí (PLN). El expediente vence el 6 de septiembre de 2027 si no se aprueba antes.",
        "en": "Framework for the responsible promotion of AI with an emphasis on fundamental rights. The current substitute text (March 2025) creates the Inter-Institutional Commission for the Development of AI (CIDIA), attached to MICITT, and an ethical, technical and scientific advisory committee; it defines the high-risk systems category and penalizes the use of AI to spread disinformation through linguistic content and to create video, image or voice files made to appear authentic in order to deceive. It has a majority affirmative committee report from the Human Rights Committee and has been on the Plenary agenda since April 2025, without a vote. Filed by Óscar Izquierdo Sandí (PLN). The bill expires on September 6, 2027 if it is not approved before then."
      },
      "estado": "dictaminado",
      "alcanceIA": "principal",
      "comision": {
        "es": "Derechos Humanos",
        "en": "Human Rights"
      },
      "presentado": "2023",
      "fuenteUrl": "https://delfino.cr/asamblea/proyecto/23919",
      "fuenteEstadoUrl": "https://www.asamblea.go.cr/ca/Lists/cp/DispForm.aspx?ContentTypeId=0x01008922D325D4FE564292B03FD67DF003A7&ID=22860",
      "fechaUltimaVerificacion": "2026-08-21"
    },
    {
      "numero": "24.484",
      "titulo": {
        "es": "Ley para la Implementación de Sistemas de Inteligencia Artificial",
        "en": "Law for the Implementation of Artificial Intelligence Systems"
      },
      "resumen": {
        "es": "Marco general basado en el nivel de riesgo. El texto sustitutivo vigente (octubre 2025) asigna al MICITT la rectoría y la coordinación con otras siete instituciones, y alcanza a personas físicas y jurídicas extranjeras cuyos sistemas surtan efectos en el país. Es el único de los tres proyectos generales que define expresamente la inteligencia artificial generativa como categoría funcional general, además de la falsificación profunda (deepfakes). Cuenta con dictamen afirmativo unánime en la Comisión de Ciencia, Tecnología y Educación (octubre 2025) y está en el orden del día del Plenario desde febrero de 2026, sin votación. Proponentes: Johana Obando Bonilla y tres diputaciones más. El expediente vence el 6 de agosto de 2028 si no se aprueba antes.",
        "en": "Risk-based general framework. The current substitute text (October 2025) assigns MICITT the governing role and coordination with seven other institutions, and reaches foreign individuals and legal entities whose systems have effects in the country. It is the only one of the three general bills that expressly defines generative artificial intelligence as a general functional category, in addition to deep fakes. It has a unanimous affirmative committee report from the Science, Technology and Education Committee (October 2025) and has been on the Plenary agenda since February 2026, without a vote. Filed by Johana Obando Bonilla and three other legislators. The bill expires on August 6, 2028 if it is not approved before then."
      },
      "estado": "dictaminado",
      "alcanceIA": "principal",
      "comision": {
        "es": "Ciencia, Tecnología y Educación",
        "en": "Science, Technology and Education"
      },
      "presentado": "2024",
      "fuenteUrl": "https://delfino.cr/asamblea/proyecto/24484",
      "fuenteEstadoUrl": "https://www.asamblea.go.cr/ca/Lists/cp/DispForm.aspx?ContentTypeId=0x01008922D325D4FE564292B03FD67DF003A7&ID=22860",
      "fechaUltimaVerificacion": "2026-08-21"
    },
    {
      "numero": "24.875",
      "titulo": {
        "es": "Ley para Regular el Uso de Inteligencia Artificial en los Procesos Electorales",
        "en": "Law to Regulate the Use of Artificial Intelligence in Electoral Processes"
      },
      "resumen": {
        "es": "Establece obligaciones de divulgación para contenido generado con IA y propone prohibiciones sobre deepfakes electorales, cuentas falsas automatizadas y estrategias de microsegmentación diseñadas para socavar la integridad electoral. Contempla multas de 10 a 50 salarios base. Al corte oficial del 7 de abril de 2026 permanecía en comisión, sin texto sustitutivo ni dictamen; se registraron mociones posteriores, pero no se encontró evidencia oficial de un cambio de estado. Proponente: Vanessa De Paul Castro Mora (PUSC).",
        "en": "Establishes disclosure duties for AI-generated content and proposes prohibitions on electoral deepfakes, automated fake accounts and microtargeting strategies designed to undermine electoral integrity. It provides for fines from 10 to 50 base salaries. At the official April 7, 2026 cutoff it remained in committee, with no substitute text or committee report; later motions were recorded, but no official evidence of a status change was found. Filed by Vanessa De Paul Castro Mora (PUSC)."
      },
      "estado": "en-comision",
      "alcanceIA": "principal",
      "comision": {
        "es": "Reformas Electorales",
        "en": "Electoral Reform"
      },
      "presentado": "2025",